{
  "protocol": "socrates-evals",
  "schema_version": "1.0",
  "model_sets": {
    "cross-host-default": {
      "codex": ["gpt-5.6-sol", "gpt-5.6-terra"],
      "claude": ["sonnet", "haiku"]
    },
    "node-lts": {
      "node": ["22", "24"]
    }
  },
  "cases": [
    {
      "id": "explain-database-index-eli5",
      "group": "explanation",
      "prompt": "Explain what a database index is to someone new to backend development.",
      "fixture": null,
      "expected_action_class": "direct-explanation",
      "forbidden_actions": ["withhold the explanation behind questions", "append a quiz"],
      "required_output_fields": ["core idea", "concrete mental model", "small visual", "why it matters"],
      "expected_mutation": "none",
      "expected_questions": {"min": 0, "max": 0},
      "hosts": ["codex", "claude"],
      "models": "cross-host-default",
      "static_grader_ids": ["trigger-description", "interaction-routing", "visual-explanation", "efficient-learning"],
      "live_grader_id": "direct-eli5"
    },
    {
      "id": "explain-race-condition-engineer",
      "group": "explanation",
      "prompt": "Explain race conditions to an experienced backend engineer. Focus on mechanism, invariants, and trade-offs; no quiz.",
      "fixture": null,
      "expected_action_class": "technical-explanation",
      "forbidden_actions": ["remove essential terminology", "teach elementary programming"],
      "required_output_fields": ["mechanism", "shared state or ordering", "trade-off"],
      "expected_mutation": "none",
      "expected_questions": {"min": 0, "max": 0},
      "hosts": ["codex", "claude"],
      "models": "cross-host-default",
      "static_grader_ids": ["trigger-description", "audience-calibration"],
      "live_grader_id": "technical-explanation"
    },
    {
      "id": "deliverable-manager-rate-limit",
      "group": "explanation",
      "prompt": "Write a short explanation I can send directly to my manager: our API rate limit is causing failures at peak time, and we can either reduce calls or buy a higher tier.",
      "fixture": null,
      "expected_action_class": "audience-deliverable",
      "forbidden_actions": ["quiz the original user", "lead with implementation detail"],
      "required_output_fields": ["business impact", "options", "decision"],
      "expected_mutation": "none",
      "expected_questions": {"min": 0, "max": 1},
      "hosts": ["codex", "claude"],
      "models": "cross-host-default",
      "static_grader_ids": ["interaction-routing", "audience-calibration"],
      "live_grader_id": "manager-deliverable"
    },
    {
      "id": "explain-source-grounded-code",
      "group": "explanation",
      "prompt": "Explain what retry.js actually does for a junior engineer. Use the file as evidence and mention the important failure behavior. Do not quiz me.",
      "fixture": "fixtures/source-grounded",
      "expected_action_class": "source-grounded-explanation",
      "forbidden_actions": ["invent behavior not present in the file", "ignore the retry limit"],
      "required_output_fields": ["attempt count", "delay behavior", "final error"],
      "expected_mutation": "none",
      "expected_questions": {"min": 0, "max": 0},
      "hosts": ["codex", "claude"],
      "models": "cross-host-default",
      "static_grader_ids": ["source-grounding", "fixture-safety"],
      "live_grader_id": "source-grounded"
    },
    {
      "id": "explain-brownfield-scheduled-orders",
      "group": "explanation",
      "prompt": "I'm new to this codebase and need to add scheduled orders. Before I change anything, help me understand the current order-creation flow, what must remain true, and where this feature would likely connect.",
      "fixture": "fixtures/brownfield-orders",
      "expected_action_class": "brownfield-change-explanation",
      "forbidden_actions": ["edit the fixture", "blur current behavior with a proposed design", "present scheduled-order support as already implemented"],
      "required_output_fields": ["current flow", "preserved invariants", "proposed extension point", "test impact", "compact visual"],
      "expected_mutation": "none",
      "expected_questions": {"min": 0, "max": 0},
      "hosts": ["codex", "claude"],
      "models": "cross-host-default",
      "static_grader_ids": ["source-grounding", "brownfield-grounding", "brownfield-fixture", "visual-explanation"],
      "live_grader_id": "brownfield-feature"
    },
    {
      "id": "guided-photosynthesis-opening",
      "group": "guided",
      "prompt": "Teach me photosynthesis Socratically. I know plants need sunlight, but not much else. Start the lesson.",
      "fixture": null,
      "expected_action_class": "guided-opening",
      "forbidden_actions": ["dump the full lesson", "ask several questions at once"],
      "required_output_fields": ["useful starting model", "one focused question"],
      "expected_mutation": "none",
      "expected_questions": {"min": 1, "max": 1},
      "hosts": ["codex", "claude"],
      "models": "cross-host-default",
      "static_grader_ids": ["interaction-routing", "mastery-gate"],
      "live_grader_id": "guided-opening"
    },
    {
      "id": "guided-cache-misconception",
      "group": "guided",
      "prompt": "We are learning cache freshness. The current objective is understanding how cached data gets refreshed after the source changes. You asked how a cache knows its copy is stale, and I answered: ‘It notices the original changed on its own.’ Continue from my answer.",
      "fixture": null,
      "expected_action_class": "repair-misconception",
      "forbidden_actions": ["advance to cache-performance tuning", "praise the answer as correct"],
      "required_output_fields": ["specific correction", "smaller support", "same-objective re-check"],
      "expected_mutation": "none",
      "expected_questions": {"min": 1, "max": 1},
      "hosts": ["codex", "claude"],
      "models": "cross-host-default",
      "static_grader_ids": ["mastery-gate", "adaptive-repair"],
      "live_grader_id": "mastery-misconception"
    },
    {
      "id": "guided-cache-partial",
      "group": "guided",
      "prompt": "We are learning cache freshness. The current objective is understanding how cached data gets refreshed after the source changes. You asked how a stale cached copy gets replaced, and I answered: ‘It expires.’ Continue from my answer.",
      "fixture": null,
      "expected_action_class": "repair-partial-answer",
      "forbidden_actions": ["advance to cache-performance tuning", "treat expiration alone as a complete mechanism"],
      "required_output_fields": ["preserve correct part", "identify missing link", "same-objective re-check"],
      "expected_mutation": "none",
      "expected_questions": {"min": 1, "max": 1},
      "hosts": ["codex", "claude"],
      "models": "cross-host-default",
      "static_grader_ids": ["mastery-gate", "adaptive-repair"],
      "live_grader_id": "mastery-partial"
    },
    {
      "id": "guided-cache-correct",
      "group": "guided",
      "prompt": "We are learning cache freshness. The current objective is understanding how cached data gets refreshed after the source changes. I answered: ‘A cache does not know by itself. Expiration or explicit invalidation marks the copy unusable, and the next read fetches the source again.’ Continue from my answer.",
      "fixture": null,
      "expected_action_class": "advance-after-mastery",
      "forbidden_actions": ["re-teach invalidation as if the answer were wrong", "give generic praise without evidence"],
      "required_output_fields": ["evidence-based acknowledgment", "next objective"],
      "expected_mutation": "none",
      "expected_questions": {"min": 1, "max": 1},
      "hosts": ["codex", "claude"],
      "models": "cross-host-default",
      "static_grader_ids": ["mastery-gate", "efficient-learning"],
      "live_grader_id": "mastery-correct"
    },
    {
      "id": "guided-cache-uncertain",
      "group": "guided",
      "prompt": "We are learning cache freshness. The current objective is understanding how cached data gets refreshed after the source changes. I answered your question with: ‘I have no idea.’ Continue from my answer.",
      "fixture": null,
      "expected_action_class": "lower-difficulty",
      "forbidden_actions": ["advance to a new concept", "repeat the original question unchanged"],
      "required_output_fields": ["concrete foothold", "same-objective re-check"],
      "expected_mutation": "none",
      "expected_questions": {"min": 1, "max": 1},
      "hosts": ["codex", "claude"],
      "models": "cross-host-default",
      "static_grader_ids": ["mastery-gate", "adaptive-repair"],
      "live_grader_id": "mastery-uncertain"
    },
    {
      "id": "guided-change-representation",
      "group": "guided",
      "prompt": "You asked me ‘How does a cache know its copy is stale?’ twice. I still answered ‘it just knows.’ Stay on the same cache-freshness objective, but do not repeat that question again.",
      "fixture": null,
      "expected_action_class": "change-representation",
      "forbidden_actions": ["repeat the same question", "advance to cache-performance tuning"],
      "required_output_fields": ["different representation", "smaller same-objective question"],
      "expected_mutation": "none",
      "expected_questions": {"min": 1, "max": 1},
      "hosts": ["codex", "claude"],
      "models": "cross-host-default",
      "static_grader_ids": ["adaptive-repair"],
      "live_grader_id": "changed-representation"
    },
    {
      "id": "guided-user-opts-out",
      "group": "guided",
      "prompt": "Stop the quiz and just tell me how a database transaction prevents partial updates. I do not want another question.",
      "fixture": null,
      "expected_action_class": "direct-answer-after-opt-out",
      "forbidden_actions": ["continue the quiz", "require an answer before explaining"],